{
  "$schema": "../chain.schema.json",
  "chain_name": "odin1",
  "status": "killed",
  "network_type": "mainnet",
  "website": "https://odinprotocol.io/",
  "pretty_name": "Odin Protocol",
  "chain_type": "cosmos",
  "chain_id": "odin-mainnet-freya",
  "bech32_prefix": "odin",
  "daemon_name": "odind",
  "node_home": "$HOME/.odin",
  "key_algos": [
    "secp256k1"
  ],
  "slip44": 118,
  "fees": {
    "fee_tokens": [
      {
        "denom": "loki",
        "fixed_min_gas_price": 0.0125,
        "low_gas_price": 0.025,
        "average_gas_price": 0.05,
        "high_gas_price": 0.06
      }
    ]
  },
  "staking": {
    "staking_tokens": [
      {
        "denom": "loki"
      }
    ]
  },
  "codebase": {
    "git_repo": "https://github.com/ODIN-PROTOCOL/odin-core",
    "recommended_version": "v0.6.2",
    "compatible_versions": [
      "v0.6.2"
    ],
    "genesis": {
      "genesis_url": "https://raw.githubusercontent.com/ODIN-PROTOCOL/networks/master/mainnets/odin-mainnet-freya/genesis.json"
    }
  },
  "logo_URIs": {
    "png": "https://raw.githubusercontent.com/cosmos/chain-registry/master/odin/images/odin.png"
  },
  "peers": {
    "seeds": [
      {
        "id": "20e1000e88125698264454a884812746c2eb4807",
        "address": "seeds.lavenderfive.com:16856",
        "provider": "Lavender.Five Nodes 🐝"
      }
    ],
    "persistent_peers": [
      {
        "id": "9d16b1ce74a34b869d69ad5fe34eaca614a36ecd",
        "address": "35.241.238.207:26656",
        "provider": "Odin Protocol"
      },
      {
        "id": "02e905f49e1b869f55ad010979931b542302a9e6",
        "address": "35.241.221.154:26656",
        "provider": "Odin Protocol"
      },
      {
        "id": "4847c79f1601d24d3605278a0183d416a99aa093",
        "address": "34.140.252.7:26656",
        "provider": "Odin Protocol"
      },
      {
        "id": "0165cd0d60549a37abb00b6acc8227a54609c648",
        "address": "34.79.179.216:26656",
        "provider": "Odin Protocol"
      }
    ]
  },
  "apis": {
    "rpc": [
      {
        "address": "http://34.79.179.216:26657",
        "provider": "Odin Protocol"
      },
      {
        "address": "https://rpc.lavenderfive.com:443/odin",
        "provider": "Lavender.Five Nodes 🐝"
      }
    ],
    "rest": [
      {
        "address": "http://34.79.179.216:1317/",
        "provider": "Odin Protocol"
      },
      {
        "address": "https://rest.lavenderfive.com:443/odin",
        "provider": "Lavender.Five Nodes 🐝"
      }
    ],
    "grpc": [
      {
        "address": "odin.lavenderfive.com:443",
        "provider": "Lavender.Five Nodes 🐝"
      }
    ]
  },
  "explorers": [
    {
      "kind": "odin web",
      "url": "https://mainnet.odinprotocol.io/",
      "tx_page": "https://mainnet.odinprotocol.io/transactions/${txHash}"
    },
    {
      "kind": "ping.pub",
      "url": "https://ping.pub/odin",
      "tx_page": "https://ping.pub/odin/tx/${txHash}"
    }
  ],
  "images": [
    {
      "image_sync": {
        "chain_name": "odin1",
        "base_denom": "loki"
      },
      "png": "https://raw.githubusercontent.com/cosmos/chain-registry/master/odin/images/odin.png"
    }
  ]
}