{
  "$schema": "../../chain.schema.json",
  "chain_name": "namada",
  "status": "live",
  "network_type": "mainnet",
  "website": "https://namada.net",
  "pretty_name": "Namada",
  "chain_type": "unknown",
  "chain_id": "namada.5f5de2dd1b88cba30586420",
  "slip44": 877,
  "bech32_prefix": "tnam",
  "daemon_name": "unam",
  "key_algos": [
    "ed25519"
  ],
  "fees": {
    "fee_tokens": [
      {
        "denom": "unam",
        "fixed_min_gas_price": 0.0025,
        "low_gas_price": 0.0025,
        "average_gas_price": 0.025,
        "high_gas_price": 0.04
      }
    ]
  },
  "staking": {
    "staking_tokens": [
      {
        "denom": "unam"
      }
    ],
    "lock_duration": {
      "time": "1209600s"
    }
  },
  "codebase": {
    "git_repo": "https://github.com/anoma/namada"
  },
  "apis": {
    "rpc": [
      {
        "provider": "TuDudes",
        "address": "https://rpc.namada.tududes.com"
      },
      {
        "provider": "Mandragora",
        "address": "https://namada-rpc.mandragora.io"
      },
      {
        "provider": "PowerStaking",
        "address": "https://namadam.powerstaking.tech"
      },
      {
        "provider": "stake.systems",
        "address": "https://namada-main.stakesystems.io"
      },
      {
        "provider": "5ElementsNodes",
        "address": "https://rpc-namada.5elementsnodes.com"
      },
      {
        "provider": "itrocket-team",
        "address": "https://namada-mainnet-rpc.itrocket.net"
      },
      {
        "provider": "Sproutstake",
        "address": "https://namada-rpc.sproutstake.space"
      },
      {
        "provider": "Papadritta",
        "address": "https://rpc.papadritta.com"
      },
      {
        "provider": "Decentrio",
        "address": "https://namada.rpc.decentrio.ventures"
      },
      {
        "provider": "StakePool",
        "address": "https://rpc.namada.stakepool.dev.br"
      },
      {
        "provider": "TNSO",
        "address": "https://rpc.namadascan.io"
      },
      {
        "provider": "Synergy",
        "address": "https://namada-rpc.synergynodes.com"
      },
      {
        "provider": "L0vd",
        "address": "https://namada-mainnet.rpc.l0vd.com:443"
      },
      {
        "provider": "Loser",
        "address": "https://namada.loserboy.xyz"
      },
      {
        "provider": "jacky1988",
        "address": "https://namada.itudou.xyz"
      },
      {
        "provider": "Validatus",
        "address": "https://rpc.namada.validatus.com"
      },
      {
        "provider": "anodeofzen",
        "address": "https://namada-rpc.zenode.app"
      }
    ]
  },
  "explorers": [
    {
      "kind": "Explorer75",
      "url": "https://explorer75.org/namada",
      "tx_page": "https://explorer75.org/namada/tx/${txHash}",
      "account_page": "https://explorer75.org/namada/accounts/${accountAddress}"
    },
    {
      "kind": "Valopers",
      "url": "https://namada.valopers.com/",
      "tx_page": "https://namada.valopers.com/transactions/${txHash}",
      "account_page": "https://namada.valopers.com/account/${accountAddress}"
    },
    {
      "kind": "Shielded.Live",
      "url": "https://shielded.live",
      "tx_page": "https://shielded.live/txs/${txHash}",
      "account_page": "https://shielded.live/address/${accountAddress}"
    },
    {
      "kind": "Sproutstake",
      "url": "https://namada-explorer.sproutstake.space",
      "tx_page": "https://namada-explorer.sproutstake.space/main/transactions/${txHash}",
      "account_page": "https://namada-explorer.sproutstake.space/main/accounts/${accountAddress}"
    },
    {
      "kind": "Coverlet",
      "url": "https://namada.coverlet.io/",
      "tx_page": "https://namada.coverlet.io/tx/${txHash}"
    }
  ],
  "logo_URIs": {
    "svg": "https://raw.githubusercontent.com/cosmos/chain-registry/master/_non-cosmos/namada/images/namada.svg"
  }
}